{
  "$schema": "http://json-schema.org/draft-07/schema#",
  "title": "ALerts articles.json",
  "description": "The data contract between the curator agent (write) and the static reader (read).",
  "type": "array",
  "items": {
    "type": "object",
    "additionalProperties": false,
    "required": ["id", "title", "url", "source", "summary", "topic", "publishedDate", "addedDate"],
    "properties": {
      "id": {
        "type": "string",
        "minLength": 1,
        "description": "Stable unique id; used in the static article page URL."
      },
      "title": { "type": "string", "minLength": 1, "description": "Article headline." },
      "url": {
        "type": "string",
        "pattern": "^https?://",
        "description": "Original source URL (link-out target)."
      },
      "source": { "type": "string", "minLength": 1, "description": "Publication name." },
      "summary": {
        "type": "string",
        "minLength": 1,
        "description": "Short summary generated by the agent at publish time."
      },
      "topic": {
        "type": "string",
        "minLength": 1,
        "description": "'Latest' or the topic prompt used to find the article."
      },
      "publishedDate": {
        "type": "string",
        "pattern": "^\\d{4}-\\d{2}-\\d{2}$",
        "description": "Original publication date of the article (YYYY-MM-DD)."
      },
      "addedDate": {
        "type": "string",
        "pattern": "^\\d{4}-\\d{2}-\\d{2}$",
        "description": "When the curator published it via the agent (YYYY-MM-DD)."
      },
      "audience": {
        "type": "array",
        "minItems": 1,
        "uniqueItems": true,
        "items": {
          "type": "string",
          "enum": ["developers", "qa", "ba-pc", "pm", "non-technical"]
        },
        "description": "Which i2e roles genuinely benefit: developers (Developers/Coders), qa (QA), ba-pc (BAs & Project Coordinators), pm (Project Managers), non-technical (Non-technical users). Optional."
      },
      "relevance": {
        "type": "object",
        "additionalProperties": false,
        "required": ["whyRelevant", "dailyImpact", "practicalBenefit"],
        "properties": {
          "whyRelevant": { "type": "string", "minLength": 1, "description": "Answers 'Why is this relevant to me?' for an i2e reader." },
          "dailyImpact": { "type": "string", "minLength": 1, "description": "Answers 'How will this help in my daily job?'" },
          "practicalBenefit": { "type": "string", "minLength": 1, "description": "Answers 'What practical benefit does it provide?'" }
        },
        "description": "Reader-facing relevance framing for i2e employees; optional, present on the newest items."
      }
    }
  }
}
